ORGANIZACION,Comentario,Comentario Sin tratar,Etiqueta,Analyzer
mexico evalua,organizacion brindo beneficios comedor transporte remuneracion economica nunca acordamos harian ademas recibi oferta contratacion per director programa participe comunico manera mas informal proximo ano buscarian posibilidad incluirme algun proyecto ofrecerme remuneracion economica practicas enriquecedoras probablemente sido mas poder llevarlas acabo manera presencial,la organizacion no me brindo beneficios como comedor transporte o remuneracion economica pero nunca acordamos que lo harian ademas no recibi una oferta de contratacion per se pero el director del programa en el que participe me comunico de manera mas informal que el proximo ano buscarian la posibilidad de incluirme en algun proyecto y ofrecerme remuneracion economica las practicas fueron muy enriquecedoras y probablemente lo hubieran sido mas de poder llevarlas acabo de manera presencial ,positive,"AnalyzerOutput(output=NEU, probas={NEU: 0.779, POS: 0.191, NEG: 0.030})"
insp,excelente lugar solo respeto ademas agradecimiento maestra hegewisch,excelente lugar y solo respeto ademas de agradecimiento para la maestra hegewisch,positive,"AnalyzerOutput(output=POS, probas={POS: 0.957, NEU: 0.038, NEG: 0.004})"
accurate media,punto brindar beneficios asi practicas linea,en el punto de brindar los beneficios no fue asi porque las practicas fueron en linea ,neutral,"AnalyzerOutput(output=NEU, probas={NEU: 0.623, POS: 0.359, NEG: 0.017})"
servicio de informacion sobre medicamentos en linea,aprendi muchisimo practicas dra lucila siempre pendiente cualquier duda comentario buen proyecto,aprendi muchisimo en estas practicas  la dra lucila siempre estaba al pendiente de cualquier duda o comentario muy buen proyecto ,positive,"AnalyzerOutput(output=POS, probas={POS: 0.871, NEU: 0.124, NEG: 0.005})"
propuesta de snacks saludables,padres actividades excelente trabajo equipo,muy padres las actividades y excelente trabajo en equipo ,positive,"AnalyzerOutput(output=POS, probas={POS: 0.963, NEU: 0.033, NEG: 0.004})"
accurate media,encanto trabajar ustedes gran equipo emociono formar parte equipo legal temas tan innovadores creacion aplicacion muchas gracias hacerme parte equipo,me encanto trabajar con ustedes son un gran equipo me emociono mucho formar parte del equipo legal en temas tan innovadores como la creacion de una aplicacion muchas gracias por hacerme parte de su equipo,positive,"AnalyzerOutput(output=POS, probas={POS: 0.976, NEU: 0.021, NEG: 0.003})"
birth group,aun duda si ofrecen alguna oferta parte empresa,aun esta en duda si me ofrecen alguna oferta por parte de la empresa,positive,"AnalyzerOutput(output=NEU, probas={NEU: 0.912, NEG: 0.071, POS: 0.017})"
notaria publica no  de puebla,contento haber realizado practicas profesionales notaria puebla,muy contento de haber realizado mis practicas profesionales en la notaria  de puebla,positive,"AnalyzerOutput(output=POS, probas={POS: 0.694, NEU: 0.288, NEG: 0.019})"
ozono polaris,atencion puso ingeniero mackay trabajo realizad parte bastante grata dio buena experiencia iniciar carrera profesional lamentablemente pandemia impidio estuvieramos manera fisica sido gran experiencia,la atencion que puso el ingeniero mackay en el trabajo realizad por mi parte fue bastante grata dio una buena experiencia para iniciar mi carrera profesional lamentablemente la pandemia impidio que estuvieramos de manera fisica y esto hubiera sido una gran experiencia,positive,"AnalyzerOutput(output=POS, probas={POS: 0.898, NEU: 0.094, NEG: 0.008})"
egate,bien trabajar dicha organizacion udlap universidad prestigio invierte economicamente dinero poder salir buen empleo,hubiera estado bien trabajar en dicha organizacion ya que la udlap es una universidad de prestigio la cual se invierte economicamente mucho dinero para poder salir con un buen empleo  ,positive,"AnalyzerOutput(output=POS, probas={POS: 0.797, NEU: 0.194, NEG: 0.009})"
clariant,falto organizacion plan trabajo disenaron asi mayor acompanamiento actividades capacitacion hacer home office definitivamente volvio reto interaccion organizacion practicante,falto organizacion en el plan de trabajo que disenaron para mi asi como un mayor acompanamiento tanto en actividades como en capacitacion el hacer home office definitivamente volvio un reto la interaccion entre organizacion y practicante ,negative,"AnalyzerOutput(output=NEU, probas={NEU: 0.811, POS: 0.133, NEG: 0.056})"
binarapp,agradezco binarapp darme oportunidad,agradezco a binarapp por darme la oportunidad,positive,"AnalyzerOutput(output=NEU, probas={NEU: 0.500, POS: 0.468, NEG: 0.032})"
indice de impunidad estados unidos,transporte comida na pandemia embargo decepcionada haber podido aprender proyecto ofrecido cuestion ademas capacitacion incompleta,lo del transporte y comida na por la pandemia sin embargo estoy decepcionada de no haber podido aprender sobre el proyecto ofrecido en cuestion ademas de que la capacitacion fue incompleta,negative,"AnalyzerOutput(output=NEG, probas={NEG: 0.949, NEU: 0.048, POS: 0.003})"
azul talavera,duda aprendido procesos recursos humanos hotel ensenado valioso capital humano poder crear experiencia unica industria hospedaje tambien fortalecido aspectos personales ido desarrollando experiencia grata formar parte hotel azul talavera debido pandemia pude vivir presencial mente trabajo,sin duda he aprendido mucho de todos los procesos de recursos humanos del hotel me han ensenado lo valioso que es el capital humano para poder crear una experiencia unica en la industria del hospedaje tambien me han fortalecido muchos aspectos personales que he ido desarrollando poco a poco es una experiencia grata formar parte del hotel azul talavera pero debido a la pandemia no pude vivir presencial mente el trabajo ,positive,"AnalyzerOutput(output=POS, probas={POS: 0.705, NEU: 0.286, NEG: 0.009})"
diseno de vivienda sostenible con herramientas de bim,creo proyecto interno trabajando semestre puede aydar desarrollo profesional aprendiendo utilizar herramienta siempre aprende util,creo que el proyecto interno en el que he estado trabajando este semestre me puede aydar mucho en mi desarrollo profesional ya que estoy aprendiendo a utilizar una herramienta que no siempre se aprende y que es muy util,positive,"AnalyzerOutput(output=POS, probas={POS: 0.732, NEU: 0.255, NEG: 0.013})"
desarrollo de proyectos del departamento de computacion electronica y mecatronica,realidad debemos aceptar improvisado aunque experiencia pensaba iba ser agradecido escuela haber hecho posible cursar materia,en realidad debemos de aceptar que esto fue algo muy improvisado y que aunque no fue una experiencia como la que pensaba que iba a ser estoy agradecido con la escuela por haber hecho lo posible para cursar esta materia ,positive,"AnalyzerOutput(output=NEU, probas={NEU: 0.555, POS: 0.276, NEG: 0.169})"
competencia de estudio de caso de ascm en colaboracion con deloitte,experiencia distinta embargo adquiri nuevos conocimientos puntos vista nuevas formas solucionar problema,fue una experiencia distinta sin embargo adquiri nuevos conocimientos puntos de vista y sobre todo nuevas formas de solucionar un problema,positive,"AnalyzerOutput(output=NEU, probas={NEU: 0.850, POS: 0.116, NEG: 0.035})"
mco studios,gustaria comentar medidas sanidad tomo mco studios excelentes comparto video respecto httpsvimeocom dado confianza asistir manera personal ocasiones sido necesarias momento personal organizacion sido amable tomado tiempo capacitarme especial sofia cuevas alejandra laveaga supervisoras agradezco departamento practicas coordinadora mercedes flores ayuda atencion largo proceso daniel c,"me gustaria comentar que las medidas de sanidad que tomo mco studios fueron excelentes comparto un video al respecto httpsvimeocom lo cual me ha dado la confianza para asistir de manera personal en las ocasiones que han sido necesarias hasta el momento 
el personal de la organizacion ha sido muy amable y se ha tomado el tiempo en capacitarme en especial sofia cuevas y alejandra laveaga quienes son mis supervisoras

agradezco mucho al departamento de practicas y a mi coordinadora mercedes flores por su ayuda y atencion a lo largo de este proceso 

daniel c ",positive,"AnalyzerOutput(output=POS, probas={POS: 0.553, NEU: 0.426, NEG: 0.020})"
egate,experiencia grata aprende respecto areas comercio exterior negocios,la experiencia fue muy grata y se aprende mucho con respecto a otras areas como comercio exterior y negocios,positive,"AnalyzerOutput(output=POS, probas={POS: 0.909, NEU: 0.087, NEG: 0.004})"
accurate media,respecto beneficios practicas parece importante mencionar necesarios gracias trabajando casa ademas remuneracion economica posibilidad asegurada,con respecto a los beneficios durante las practicas me parece importante mencionar que no fueron necesarios gracias a que estuve trabajando desde casa ademas la remuneracion economica era una posibilidad pero no estaba asegurada ,neutral,"AnalyzerOutput(output=POS, probas={POS: 0.493, NEU: 0.492, NEG: 0.015})"
instituto poblano de asistencia al migrante,nombre norma elena rodriguez huerta,mi nombre es norma elena rodriguez huerta,neutral,"AnalyzerOutput(output=NEU, probas={NEU: 0.746, POS: 0.190, NEG: 0.064})"
scala,recibi beneficios parte empresa home office entonces necesario recibir apoyo economico,no recibi beneficios por parte de la empresa ya que fue home office entonces no fue necesario recibir apoyo economico ,positive,"AnalyzerOutput(output=NEU, probas={NEU: 0.751, POS: 0.215, NEG: 0.033})"
do concurso iberoamericano de derecho internacional humanitario,proyecto parecio bueno permitio usar forma practica habilidades investigacion argumentacion,el proyecto me parecio  muy bueno me permitio  usar de una forma practica mis habilidades de investigacion y argumentacion,positive,"AnalyzerOutput(output=POS, probas={POS: 0.886, NEU: 0.107, NEG: 0.006})"
imjuve cancun,equipo trabajo motivo mantener buen nivel,el equipo de trabajo me motivo a mantener un buen nivel,positive,"AnalyzerOutput(output=POS, probas={POS: 0.671, NEU: 0.299, NEG: 0.030})"
inaoe,quiza esperaba linea,quiza no fue como esperaba porque fueron en linea,neutral,"AnalyzerOutput(output=NEU, probas={NEU: 0.799, NEG: 0.133, POS: 0.068})"
nucleo alfa de psicoterapia y salud mental,pienso firmemente cerca institucion udlap organizacion poder crear lenguaje entendiese consiguiese mejor aprovechamiento materia cualquier forma considero ambos adaptamos modalidad trabajo espero organizacion pueda mejorar ambito,pienso firmemente que no estuvimos cerca tanto como institucion udlap y organizacion de poder crear un lenguaje en el que se entendiese o consiguiese un mejor aprovechamiento de la materia de cualquier forma considero que ambos nos adaptamos a esta modalidad de trabajo y espero la organizacion pueda mejorar en este ambito,positive,"AnalyzerOutput(output=NEU, probas={NEU: 0.652, POS: 0.316, NEG: 0.032})"
universidad autonoma de baja california,interactuar forma mas personal aplicantes practicas involucrarse trabajo desarrolla igual manera dar mas retroalimentacion trabajo avances,interactuar de forma mas personal con los aplicantes de practicas para involucrarse en el trabajo que se desarrolla de igual manera dar un poco mas de retroalimentacion sobre el trabajo y avances ,neutral,"AnalyzerOutput(output=NEU, probas={NEU: 0.540, POS: 0.436, NEG: 0.024})"
faurecia,contrato trabajo octubre embargo cuestiones familiares abandonar organizacion tiempo establecido experiencia ayudando ver funcionan organizaciones reales puedo aplicar aprendido practico,mi contrato de trabajo era hasta octubre del  sin embargo por cuestiones familiares tuve que abandonar la organizacion antes del tiempo establecido pero esta experiencia me esta ayudando mucho a ver como funcionan las organizaciones reales y como es que puedo aplicar lo aprendido a lo practico ,positive,"AnalyzerOutput(output=NEU, probas={NEU: 0.864, POS: 0.097, NEG: 0.039})"
binex line mexico,logre aprender muchas cosas nuevas,logre aprender muchas cosas nuevas,positive,"AnalyzerOutput(output=POS, probas={POS: 0.873, NEU: 0.119, NEG: 0.008})"
thk marketing,considero actividades realizada thk marketing mas trabajo disenador mercadologa carrera siquiera materia diseno tal ademas habia comunicacion siempre terminan culpando practicantes errores jefas comentaban ponian acuerdo decia cambiaba considero deberian cambiar actividades realizar dentro empresa ademas mejorar comunicacion orden niveles superiores,considero que las actividades realizada en thk marketing eran mas trabajo de disenador que de mercadologa ya que en la carrera ni siquiera tuvimos la materia de diseno como tal ademas no habia comunicacion y siempre terminan culpando a las practicantes por errores que las jefas no se comentaban o no se ponian de acuerdo porque una te decia algo y la otra lo cambiaba considero que deberian cambiar las actividades a realizar dentro de la empresa y ademas mejorar la comunicacion y el orden desde niveles superiores ,negative,"AnalyzerOutput(output=NEU, probas={NEU: 0.681, NEG: 0.279, POS: 0.040})"
think marketing,necesario empresa realice estrategia introduccion empleados practicantes saber bien va dirigir va hacer etc escaso comunicacion trabajo,es necesario que la empresa realice una estrategia de introduccion de empleados practicantes para saber bien a quien se va dirigir que se va hacer cuando etc para que no este escaso en comunicacion y trabajo,neutral,"AnalyzerOutput(output=NEG, probas={NEG: 0.851, NEU: 0.141, POS: 0.008})"
birth group,buena organizacion disposicion ensenarte dejan aportar ideas pesar ser practicante,es muy buena organizacion tienen la disposicion de ensenarte y te dejan aportar ideas a pesar de ser practicante,positive,"AnalyzerOutput(output=POS, probas={POS: 0.848, NEU: 0.142, NEG: 0.010})"
think marketing,practicas diseno mercadotecnia pide saber usar photoshop cada semana entregan artes vimos licenciatura unico relacionado hacer tal vez iba decir abajo arte,son practicas de diseno no de mercadotecnia se nos pide saber usar photoshop ya que cada semana se entregan como  artes lo cual no vimos en la licenciatura lo unico relacionado era hacer tal vez lo que iba a decir abajo del arte,negative,"AnalyzerOutput(output=NEU, probas={NEU: 0.798, NEG: 0.177, POS: 0.025})"
ashoka,excelente experiencia organizacion lider asignaron siempre atenta clara instrucciones daba ningun inconveniente equipo laboral agradable,"excelente experiencia con la organizacion la lider que me asignaron siempre fue muy atenta y clara con las instrucciones que me daba 
no tuve ningun inconveniente y el equipo laboral es muy agradable ",positive,"AnalyzerOutput(output=POS, probas={POS: 0.940, NEU: 0.055, NEG: 0.006})"
allianz mexico,voy contenta pues considero aprendi pude aplicar aprendi carrera alegro haber buscado opcion,me voy muy contenta pues considero que aprendi mucho y pude aplicar lo que aprendi en la carrera me alegro de haber buscado esta opcion ,positive,"AnalyzerOutput(output=POS, probas={POS: 0.931, NEU: 0.064, NEG: 0.005})"
base,aprendi empresa ambiente agradable,aprendi mucho en esta empresa el ambiente es muy agradable ,positive,"AnalyzerOutput(output=POS, probas={POS: 0.882, NEU: 0.110, NEG: 0.008})"
inmobiliaria consorcio mexicano de la llave,adaptaron situacion perfectamente desarrolle autocritica conocimientos nuevos,"se adaptaron a la situacion perfectamente
desarrolle autocritica y conocimientos nuevos  ",positive,"AnalyzerOutput(output=POS, probas={POS: 0.525, NEU: 0.455, NEG: 0.020})"
faurecia,disfrute hacer practicas faurecia adquiri conocimientos herramientas ayudaron abrir panorama area laboral duda gustaria continuar trabajando empresa,disfrute hacer mis practicas faurecia adquiri conocimientos y herramientas que me ayudaron a abrir mi panorama en el area laboral sin duda me gustaria continuar trabajando en este empresa,positive,"AnalyzerOutput(output=POS, probas={POS: 0.844, NEU: 0.149, NEG: 0.007})"
competencia de estudio de caso de ascm en colaboracion con deloitte,comentarios,sin comentarios,positive,"AnalyzerOutput(output=NEU, probas={NEU: 0.511, NEG: 0.342, POS: 0.147})"
liigh laboratorio internacional de investigacion en el genoma humano,buena experiencia requieren conocimientos previos programacion,buena experiencia se requieren conocimientos previos de programacion,positive,"AnalyzerOutput(output=POS, probas={POS: 0.791, NEU: 0.204, NEG: 0.006})"
caso de estudio de aplicacion de la kata de la mejora en el contexto de la serie kitchen nightmares,gustado tener mas acercamiento companeros tomaron mismo caso estudio kata mejora poder complementar enfoques abrirlas enfoques demas claro entendido pandemia dificil acercamiento ahi bien,me hubiera gustado tener mas acercamiento con mis companeros que tomaron el mismo caso de estudio sobre la kata de mejora para poder complementar mis enfoques y abrirlas con los enfoques de los demas claro esta entendido que por la pandemia se nos fue dificil el acercamiento de ahi en fuera todo muy bien,positive,"AnalyzerOutput(output=NEU, probas={NEU: 0.822, POS: 0.154, NEG: 0.024})"
grupo mmh,excelente empresa verdad respetaron acordado inicio capacitacion pesar ser linea completa supervisor rafael listo atento ensenaron know how armar expedientes obtencion creditos empresa siento servira futuro,excelente empresa la verdad que respetaron todo lo acordado al inicio la capacitacion a pesar de ser en linea muy completa y mi supervisor rafael muy listo y atento me ensenaron su know how de como armar expedientes para la obtencion de creditos para empresa lo cual siento me servira mucho en el futuro,positive,"AnalyzerOutput(output=POS, probas={POS: 0.711, NEU: 0.273, NEG: 0.016})"
lado b,aprendi muchas cosas embargo deja cambiar dinamica total hacerlo forma remota esperaba desenvolverme mas departamento embargo gran equipo trabajo,aprendi muchas cosas sin embargo no deja de cambiar la dinamica total al hacerlo de forma remota esperaba desenvolverme mas en el departamento sin embargo es un gran equipo de trabajo,positive,"AnalyzerOutput(output=POS, probas={POS: 0.895, NEU: 0.098, NEG: 0.007})"
despacho esparragoza ramirez y asociados,aprendi muchisimo siempre recibi trato cordial mucha paciencia amabilidad,aprendi muchisimo siempre recibi un trato cordial y de mucha paciencia y amabilidad ,positive,"AnalyzerOutput(output=POS, probas={POS: 0.907, NEU: 0.085, NEG: 0.008})"
finloop,sc,sc,positive,"AnalyzerOutput(output=NEU, probas={NEU: 0.488, NEG: 0.352, POS: 0.160})"
endeavor,organizacion completa ambiente trabajo agradable,organizacion muy completa ambiente de trabajo agradable,positive,"AnalyzerOutput(output=POS, probas={POS: 0.913, NEU: 0.084, NEG: 0.004})"
trozmer,excelente organizacion encanto mas practicas pasadas valoraron cada trabajo hice trabajaria,excelente organizacion me encanto mucho mas que mis practicas pasadas y valoraron cada trabajo que hice  trabajaria con ellos,positive,"AnalyzerOutput(output=POS, probas={POS: 0.967, NEU: 0.029, NEG: 0.004})"
desarrollo de electrodos modificados a base de nanotubos de dioxido de titanio con aplicaciones en la deteccion de moleculas de interes biomedico y ambiental,doctora monica hizo excelente trabajo ayudo formacion profesionista mejor manera,la doctora monica hizo un excelente trabajo y me ayudo a mi formacion como profesionista de la mejor manera,positive,"AnalyzerOutput(output=POS, probas={POS: 0.955, NEU: 0.040, NEG: 0.005})"
epsol,organizacion culpa pues final cuentas proyecto iba trabajar pudo realizar cuestiones pandemia actividades pusieron simples procuro aprendieramos nuevas cosas llevo orden registro actividades,la organizacion no tuvo la culpa pues a final de cuentas el proyecto en el que se iba a trabajar no se pudo realizar por las cuestiones de la pandemia por lo que las actividades que nos pusieron fueron muy simples que se procuro que aprendieramos nuevas cosas pero no se llevo un orden ni un registro de actividades,negative,"AnalyzerOutput(output=NEU, probas={NEU: 0.595, POS: 0.388, NEG: 0.017})"
propuesta de snacks saludables,satisfecho proyecto,muy satisfecho con el proyecto,positive,"AnalyzerOutput(output=POS, probas={POS: 0.874, NEU: 0.116, NEG: 0.009})"
concytep,bien ser virtual pesado aprendi quede satisfecho proyectos,todo muy bien al ser virtual fue un poco pesado pero aprendi mucho y quede satisfecho con mis proyectos,positive,"AnalyzerOutput(output=POS, probas={POS: 0.917, NEU: 0.073, NEG: 0.011})"
vitalat,experiencia empresa sido buena aprendi cosas relacionadas carrera tambien ambitos parece excelente nunca sabe puede emplear algun conocimiento externo aprendidos carrera,mi experiencia en esta empresa ha sido muy buena ya que aprendi cosas relacionadas con mi carrera y tambien en otros ambitos que me parece excelente ya que nunca se sabe cuando se puede emplear algun conocimiento externo a los aprendidos durante la carrera,positive,"AnalyzerOutput(output=POS, probas={POS: 0.831, NEU: 0.164, NEG: 0.005})"
desarrollo de proyectos del departamento de computacion electronica y mecatronica,buenas practicas aprendi cosas carrera aportaciones carreras,muy buenas practicas aprendi cosas de mi carrera y de aportaciones de otras carreras,positive,"AnalyzerOutput(output=POS, probas={POS: 0.871, NEU: 0.123, NEG: 0.006})"
indice de impunidad estados unidos,palabras pesima experiencia practicas tenerla,sin palabras por pesima experiencia de practicas al no tenerla,negative,"AnalyzerOutput(output=NEG, probas={NEG: 0.957, NEU: 0.038, POS: 0.005})"
free and green,general buena experiencia ciertos aspectos situacion actual mejores experiencia vio afectada,en general fue una buena experiencia hubo ciertos aspectos que por la situacion actual no fueron los mejores y la experiencia se vio afectada ,positive,"AnalyzerOutput(output=NEU, probas={NEU: 0.876, POS: 0.066, NEG: 0.057})"
faurecia,faurecia excelente organizacion contenta actividades equipo jefa siempre presente asi companeros pesar ser distancia siento adquiri conocimientos,faurecia es una excelente organizacion yo estuve muy contenta con mis actividades y equipo mi jefa siempre estuvo presente asi como mis companeros a pesar de ser a distancia siento que adquiri muchos conocimientos,positive,"AnalyzerOutput(output=POS, probas={POS: 0.951, NEU: 0.045, NEG: 0.004})"
granja organica la rueda,encantado permitido parte universidad ir instalaciones organizacion comprendo motivos distanciamiento social posible pese gusto trabajar organizacion,me hubiera encantado que se me hubiera permitido por parte de la universidad ir a las instalaciones de la organizacion pero comprendo que por motivos del distanciamiento social no fuera posible pese a esto me gusto mucho trabajar en esta organizacion ,positive,"AnalyzerOutput(output=POS, probas={POS: 0.641, NEU: 0.342, NEG: 0.017})"
instituto de ciencias  buap,situacion pandemia pude hacer podido hacer presencial atencion disposicion supervisor buena considero gran opcion realizar practicas,por la situacion de la pandemia no pude hacer todo lo que hubiera podido hacer en presencial pero la atencion y disposicion de mi supervisor fue muy buena y considero que es una gran opcion para realizar practicas ,positive,"AnalyzerOutput(output=NEU, probas={NEU: 0.573, POS: 0.409, NEG: 0.018})"
lado b,excelente experiencia,excelente experiencia ,positive,"AnalyzerOutput(output=POS, probas={POS: 0.754, NEU: 0.215, NEG: 0.031})"
caso de estudio de aplicacion de la kata de la mejora en el contexto de la serie kitchen nightmares,tal organizacion fisica recomendaciones sugerencias hacer,ya que como tal no hay una organizacion fisica no hay recomendaciones o sugerencias por hacer,positive,"AnalyzerOutput(output=NEU, probas={NEU: 0.913, POS: 0.044, NEG: 0.043})"
analisis de informacion estadistica sobre desigualdades de genero en el acceso a pensiones en mexico,bien excelente forma preparar estudiantes academicamente,todo muy bien excelente forma de preparar a los estudiantes academicamente,positive,"AnalyzerOutput(output=POS, probas={POS: 0.946, NEU: 0.050, NEG: 0.004})"
bachillerato amoxcalli,buena institucion interesa estudiantes,es una buena institucion que se interesa por sus estudiantes,positive,"AnalyzerOutput(output=POS, probas={POS: 0.882, NEU: 0.105, NEG: 0.013})"
think marketing,blackshiip vc think marketing,es blackshiip vc no think marketing,positive,"AnalyzerOutput(output=NEU, probas={NEU: 0.710, NEG: 0.179, POS: 0.111})"
grupo oro,excelente ambiente permitio aprender mas profesion,excelente ambiente y me permitio aprender mas sobre mi profesion,positive,"AnalyzerOutput(output=POS, probas={POS: 0.944, NEU: 0.052, NEG: 0.004})"
acem,nombre carlos ochoa escandon carlos sanchez escandon,mi nombre es carlos ochoa escandon no es carlos sanchez escandon ,positive,"AnalyzerOutput(output=NEU, probas={NEU: 0.753, POS: 0.192, NEG: 0.055})"
despacho esparragoza ramirez y asociados,mejor lugar hacer practicas profesionales aprendes muchisimo,el mejor lugar para hacer las practicas profesionales aprendes muchisimo ,positive,"AnalyzerOutput(output=POS, probas={POS: 0.957, NEU: 0.037, NEG: 0.006})"
elaboracion de guias nutrimentales para pacientes con enfermedad renal cronica y diferentes comorbilidades,adecuado,todo estuvo adecuado,positive,"AnalyzerOutput(output=NEU, probas={NEU: 0.514, NEG: 0.311, POS: 0.175})"
