ORGANIZACION,Comentario,Comentario Sin tratar,Etiqueta,Analyzer
proyecto cafeina,honestamente disfrute experiencia proyecto asignaron sintio clase mas universitaria involucraron despacho realmente aprendi trabaja dentro despacho simplemente aprendi personas excelentes siempre teniamos dudas ahi atentos honestamente experiencia esperando sugerencia organizacion siguientes practicantes involucren ustedes estan haciendo sirve dejen proyecto veamos vez semana unicamente presentarlo tipo dinamicas haciendo largo carrera,honestamente no disfrute nada la experiencia el proyecto que nos asignaron se sintio como una clase mas universitaria no nos involucraron al despacho realmente no aprendi como se trabaja dentro de un despacho simplemente no aprendi nada ellos como personas son excelentes siempre que teniamos dudas estaban ahi para nosotros y fueron muy atentos pero honestamente no fue la experiencia que estaba esperando mi sugerencia para la organizacion es que a sus siguientes practicantes los involucren en lo que ustedes estan haciendo de nada sirve que nos dejen un proyecto y que nos veamos una vez a la semana unicamente para presentarlo porque este tipo de dinamicas es lo que hemos estado haciendo a lo largo de nuestra carrera ,negative,"AnalyzerOutput(output=POS, probas={POS: 0.695, NEU: 0.297, NEG: 0.008})"
buap,mayor comunicacion,mayor comunicacion ,positive,"AnalyzerOutput(output=NEU, probas={NEU: 0.685, NEG: 0.182, POS: 0.134})"
hospital puebla,bien,todo muy bien,positive,"AnalyzerOutput(output=NEU, probas={NEU: 0.476, POS: 0.294, NEG: 0.230})"
hospital puebla,consciente encontramos situacion extraordinaria practicas realizadas linea obstante parecer deberia impedir comunicacion eficiente referencia entrega mas actividades realizar,"estoy consciente que nos encontramos en una situacion extraordinaria con las practicas realizadas en linea no obstante a mi parecer eso no deberia de impedir una comunicacion eficiente 
con referencia la entrega de mas actividades a realizar  ",negative,"AnalyzerOutput(output=NEG, probas={NEG: 0.787, NEU: 0.198, POS: 0.015})"
hospital puebla,sabemos encontramos situacion extraordinaria practicas realizadas remoto nunca hechas embargo considero excusa situaciones total incomunicacion entrega trabajos realizar respuestas concluyentes menos respecto situacion actual actividades organizacion,sabemos que nos encontramos en una situacion extraordinaria con practicas realizadas en un estado remoto nunca antes hechas sin embargo considero que eso no excusa situaciones de total incomunicacion para la entrega de trabajos a realizar sin respuestas concluyentes o al menos con respecto a la situacion actual de las actividades en la organizacion,negative,"AnalyzerOutput(output=NEG, probas={NEG: 0.609, NEU: 0.374, POS: 0.018})"
hospital puebla,proyecto dado hospital puebla brindo aprendizaje procedimientos realizan hospital embargo creo escasos procedimientos proporcionaron dos meses,el proyecto dado por el hospital puebla  brindo aprendizaje de algunos procedimientos que se realizan en un hospital sin embargo creo que fueron muy escasos los procedimientos que se proporcionaron en los dos meses ,positive,"AnalyzerOutput(output=NEG, probas={NEG: 0.497, NEU: 0.469, POS: 0.034})"
centro de investigaciones en optica,definitivamente buena experiencia dada modalidad pude tomarla poder desarrollarme conocer nuevas perspectivas integrar carrera distintos ambitos,definitivamente una buena experiencia dada la modalidad en la que pude tomarla el poder desarrollarme y conocer nuevas perspectivas de como integrar mi carrera a distintos ambitos,positive,"AnalyzerOutput(output=POS, probas={POS: 0.942, NEU: 0.054, NEG: 0.004})"
bimbo,empresa apoyando demasiado momento sido amables conmigo,la empresa me esta apoyando demasiado y en todo momento han sido muy amables conmigo,positive,"AnalyzerOutput(output=POS, probas={POS: 0.953, NEU: 0.041, NEG: 0.006})"
asistencia regulatoria mexico,realizar practicas profesionales asistencia regulatoria mexico satisfactorio,realizar practicas profesionales en asistencia regulatoria mexico fue muy satisfactorio,positive,"AnalyzerOutput(output=POS, probas={POS: 0.919, NEU: 0.070, NEG: 0.011})"
sylvatica,excelente organizacion recomendada futuros aplicantes,excelente organizacion muy recomendada para futuros aplicantes,positive,"AnalyzerOutput(output=POS, probas={POS: 0.925, NEU: 0.071, NEG: 0.004})"
ozono polaris,buena empresa proyectos interesantes buen trato,muy buena empresa con proyectos muy interesantes y un buen trato ,positive,"AnalyzerOutput(output=POS, probas={POS: 0.960, NEU: 0.036, NEG: 0.004})"
proyecto cafeina,sugiero si proyecto sera ajeno trabajo interno despacho especifique carta inicio practicas menos guie proyecto hipotetico vision flujo trabajo empresa experimentar realidad despacho,sugiero que si el proyecto sera ajeno al trabajo interno del despacho se especifique en la carta de inicio de practicas y que al menos se guie el proyecto hipotetico con la vision y flujo de trabajo de la empresa para experimentar un poco de la realidad del despacho,neutral,"AnalyzerOutput(output=NEU, probas={NEU: 0.879, NEG: 0.068, POS: 0.052})"
iexe universidad,primer periodo practicas ayudo familiarizarme trabajar evaluadora sector publico asi poder ver manejan fondos programas tener gobierno cliente cierto caos atenernos tiempos entrega veces tardaban entregarnos documentacion,este primer periodo de practicas me ayudo a familiarizarme como es trabajar como evaluadora del sector publico asi como poder ver como se manejan los fondos para programas al tener al gobierno como cliente hubo cierto caos ya que era atenernos a sus tiempos de entrega y a veces ellos tardaban en entregarnos documentacion,positive,"AnalyzerOutput(output=NEU, probas={NEU: 0.588, NEG: 0.392, POS: 0.020})"
epsol energy  power system solutions,encargados proyectos practicas mucha ayuda siempre paciencia tratado respeto,los encargados de proyectos de practicas fueron de mucha ayuda siempre me tuvieron paciencia y me han tratado con respeto ,positive,"AnalyzerOutput(output=POS, probas={POS: 0.763, NEU: 0.224, NEG: 0.013})"
laboratorios ruiz,necesitan llevar mejor organizacion contacto estudiantes,necesitan llevar una mejor organizacion y contacto con los estudiantes,neutral,"AnalyzerOutput(output=NEU, probas={NEU: 0.808, POS: 0.153, NEG: 0.039})"
dominguez y buis galeria,excelente organizacion espero realicen mas convenios situacion pandemica permita expandir oportunidades siguientes generaciones,excelente organizacion espero que se realicen mas convenios y la situacion pandemica permita expandir las oportunidades de las siguientes generaciones,positive,"AnalyzerOutput(output=POS, probas={POS: 0.776, NEU: 0.212, NEG: 0.012})"
accurate media,mas recalco organizacion buena comunicacion momento capacitar practicantes actividades diarias siempre comunicacion buena companeros practicantes supervisora satisfecha hacer practicas organizacion,lo que mas recalco de la organizacion es su buena comunicacion en todo momento desde capacitar a los practicantes y en las actividades diarias siempre tuve una comunicacion muy buena con mis companeros practicantes como con mi supervisora estoy muy satisfecha de hacer mis practicas con la organizacion ,positive,"AnalyzerOutput(output=POS, probas={POS: 0.629, NEU: 0.361, NEG: 0.009})"
agencia consular de francia en puebla,siempre estare agradecido consul cervantes oportunidad si bien solo pude meses equipo participacion activa trabajo enriquecedor estudiante relaciones internacionales recomiendo altamente cualquier companero carrera realizar practicas acfm,siempre estare agradecido con la consul cervantes por la oportunidad si bien solo pude estar  meses con el equipo mi participacion fue muy activa y mi trabajo muy enriquecedor soy un estudiante de relaciones internacionales y recomiendo altamente a cualquier companero de la carrera a realizar sus practicas en la acfm,positive,"AnalyzerOutput(output=POS, probas={POS: 0.775, NEU: 0.216, NEG: 0.010})"
agencia de  energia del estado de puebla,excelente experiencia trato parte personas agencia ademas orientan buena manera,excelente experiencia y trato por parte de las personas de la agencia ademas te orientan de una buena manera ,positive,"AnalyzerOutput(output=POS, probas={POS: 0.971, NEU: 0.025, NEG: 0.004})"
reemsa,practicas llevan cabo forma remota siento comunicacion excelente puedo contactar arquitecta personal forma rapida traves plataformas comunicacion whatsapp zoom google meet, ya que las practicas se llevan a cabo de forma remota siento que la comunicacion es excelente porque puedo contactar a la arquitecta y al personal de forma rapida a traves de plataformas de comunicacion como whatsapp zoom o google meet,positive,"AnalyzerOutput(output=NEU, probas={NEU: 0.648, POS: 0.328, NEG: 0.024})"
habla logistica y mercadotecnia,buena empresa hacer practicas estudiante,muy buena empresa para hacer las practicas como estudiante ,positive,"AnalyzerOutput(output=POS, probas={POS: 0.834, NEU: 0.159, NEG: 0.007})"
ilvz estudio,querido presencial,hubiera querido que fuese presencial,neutral,"AnalyzerOutput(output=NEU, probas={NEU: 0.634, NEG: 0.262, POS: 0.104})"
new world monkeys,agrado formar parte empresa embargo personal pude mejorar desempeno debilitandose cuestiones salud desconcentracion factores debilitaron totalmente rendimiento,me agrado formar parte de la empresa sin embargo en lo personal se que que pude mejorar mi desempeno el cual fue debilitandose por cuestiones de salud la desconcentracion fue de los factores que debilitaron totalmente mi rendimiento ,positive,"AnalyzerOutput(output=NEG, probas={NEG: 0.670, NEU: 0.314, POS: 0.016})"
laboratorios ruiz,deberian poder permitirnos ir laboratorios poder aprender mejor online aprendio nuevo,deberian poder permitirnos ir a los laboratorios para poder aprender mejor ya que online no se aprendio nada nuevo ,neutral,"AnalyzerOutput(output=NEU, probas={NEU: 0.610, POS: 0.292, NEG: 0.098})"
casa tapier,ningun comentario,ningun comentario ,positive,"AnalyzerOutput(output=NEU, probas={NEU: 0.576, NEG: 0.298, POS: 0.126})"
ozono polaris,aunque pandemia afecto gran manera manera trabajo colaborar ozono polaris experiencia educativa profesional,aunque la pandemia afecto de gran manera la manera de trabajo colaborar en ozono polaris es una experiencia educativa y profesional,positive,"AnalyzerOutput(output=NEU, probas={NEU: 0.738, POS: 0.161, NEG: 0.102})"
agencia consular de francia en puebla,organizacion sirvio darme idea trabajar servicios exteriores pais aunque apenas acercamiento siento sido buena experiencia aqui,la organizacion me sirvio para darme una idea de lo que es trabajar en servicios exteriores de un pais aunque fue apenas un acercamiento siento que ha sido muy buena mi experiencia aqui ,positive,"AnalyzerOutput(output=POS, probas={POS: 0.879, NEU: 0.116, NEG: 0.005})"
girl up alc ac,inicio practicas acordo ningun tipo beneficio organizacion pregunta organizacion brindo beneficios comedor transporte remuneracion economica etc acordaron inicio practicas respondi,al inicio de las practicas no se acordo ningun tipo de beneficio con la organizacion es por esto que a la pregunta la organizacion te brindo los beneficios comedor transporte remuneracion economica etc que se acordaron al inicio de tus practicas respondi que no,positive,"AnalyzerOutput(output=NEU, probas={NEU: 0.886, NEG: 0.060, POS: 0.054})"
puercoespin creativos,buena empresa gracias experiencia adquirida mucha variedad proyectos gracias aprende varios temas siempre interesante,muy buena empresa gracias por la experiencia adquirida hay mucha variedad en los proyectos y gracias a eso se aprende mucho de varios temas y siempre es interesante ,positive,"AnalyzerOutput(output=POS, probas={POS: 0.973, NEU: 0.024, NEG: 0.002})"
intema,comunicacion casi nula dos meses trabajando solo realice entrega proyecto segundo recibido respuesta hice primera entrega gustando iba enfocado participacion embargo paso tiempo perdi interes senti estan interesados realice,la comunicacion que tuve con ellos fue casi nula de los dos meses que estuve trabajando solo realice la entrega de un proyecto porque el segundo no he recibido respuesta desde que hice mi primera entrega me estaba gustando mucho como iba enfocado mi participacion sin embargo con el paso del tiempo perdi el interes ya que senti que no estan interesados en lo que realice con ellos ,negative,"AnalyzerOutput(output=NEG, probas={NEG: 0.866, NEU: 0.129, POS: 0.005})"
tbsek,realmente buena experiencia empresa pude aprender area seguridad tambien ayudo darme cuenta realmente apasiona,realmente tuve una muy buena experiencia con esta empresa ya que pude aprender mucho sobre el area de la seguridad y tambien me ayudo a darme cuenta de que realmente es lo que me apasiona,positive,"AnalyzerOutput(output=POS, probas={POS: 0.974, NEU: 0.023, NEG: 0.003})"
global trainees,buena organizacion hacer practicas aprendiendo usando conocimientos carrera,muy buena organizacion para hacer las practicas estoy aprendiendo mucho y usando mis conocimientos de la carrera ,positive,"AnalyzerOutput(output=POS, probas={POS: 0.920, NEU: 0.076, NEG: 0.004})"
tsystems mexico,empresa requiere habilidades conocimientos mas avanzados decir materias dan final carrera,la empresa requiere habilidades y conocimientos un poco mas avanzados es decir de materias que se dan al final de la carrera,positive,"AnalyzerOutput(output=NEU, probas={NEU: 0.802, POS: 0.130, NEG: 0.069})"
habla logistica y mercadotecnia,organizacion pospuso reuniones dos semanas dejandome retroalimentacion actividades desempenando tiempo termine agregaron actividades habiamos acordado principio dicho demas bien,"la organizacion pospuso  reuniones durante dos semanas dejandome sin retroalimentacion sobre las actividades que estuve desempenando durante ese tiempo y cuando las termine me agregaron actividades que no habiamos acordado en un principio 
dicho esto todo lo demas estuvo bien",neutral,"AnalyzerOutput(output=NEU, probas={NEU: 0.741, POS: 0.230, NEG: 0.029})"
proyecto interno brain hub,proyecto interno,no estoy en este proyecto interno,negative,"AnalyzerOutput(output=NEU, probas={NEU: 0.585, NEG: 0.221, POS: 0.194})"
laboratorios ruiz,ninguno bien ojala presenciales,ninguno todo bien ojala fueran presenciales,positive,"AnalyzerOutput(output=NEG, probas={NEG: 0.696, NEU: 0.261, POS: 0.043})"
arletex,atencion brindada excelente creci persona conocimientos,la atencion brindada fue excelente creci mucho tanto como persona como de conocimientos ,positive,"AnalyzerOutput(output=POS, probas={POS: 0.829, NEU: 0.157, NEG: 0.014})"
ciclica servicios medicos integrales,aprendi muchisimo dio nueva perspectiva area laboral carrera creo comunicacion dentro empresa puede mejorar aunque pequena existen muchas lagunas suposiciones,"aprendi muchisimo y me dio una nueva perspectiva al area laboral de mi carrera
creo que la comunicacion dentro de la empresa puede mejorar ya que aunque es pequena existen muchas lagunas y suposiciones",positive,"AnalyzerOutput(output=NEU, probas={NEU: 0.745, POS: 0.213, NEG: 0.042})"
unicar plastics,preguntas estan pensadas termina practicas dificil dar respuesta adecuada formato encuesta mas facil usar,"algunas de las preguntas estan pensadas para el termina de las practicas por lo que es dificil dar una respuesta adecuada
el formato de la encuesta no es de lo mas facil de usar ",positive,"AnalyzerOutput(output=NEU, probas={NEU: 0.544, NEG: 0.436, POS: 0.020})"
agencia de energia del estado de puebla,gustado mas cumplir actividades relacionadas directamente carrera,me hubiera gustado mas el cumplir con actividades relacionadas directamente con mi carrera,neutral,"AnalyzerOutput(output=NEU, probas={NEU: 0.698, NEG: 0.203, POS: 0.099})"
terra peninsular,coordinadora practicas tarda mandar docuemtnos solicitados firmados, la coordinadora de practicas tarda en mandar los docuemtnos solicitados firmados,positive,"AnalyzerOutput(output=NEU, probas={NEU: 0.600, NEG: 0.390, POS: 0.010})"
proyecto interno el estado del arte en la inmovilizacion de enzimas con aplicaciones en salud,supone practicas aprender realizar procesos ayudaran ambito clinico recibi absoluto culpo organizacion encargados sino situacion pandemica,se supone que practicas es para aprender a realizar procesos que me ayudaran en el ambito clinico y no recibi eso en lo absoluto no culpo a la organizacion ni a los encargados sino a la situacion pandemica ,negative,"AnalyzerOutput(output=NEU, probas={NEU: 0.827, POS: 0.088, NEG: 0.085})"
bamboo boards mexico sapi de cv,general practicas satisfactorias aprendi cosas nuevas comunicacion organizacion siempre buena apoyaban dudas,en general las practicas fueron satisfactorias aprendi cosas nuevas la comunicacion con la organizacion siempre fue muy buena y me apoyaban con mis dudas ,positive,"AnalyzerOutput(output=POS, probas={POS: 0.912, NEU: 0.084, NEG: 0.004})"
laboratorio de espacio publico en mexico,excelente ambiente trabajo pude poner practica conocimientos adquirir nuevas habilidades,un excelente ambiente de trabajo en el que pude poner el practica mis conocimientos y adquirir nuevas habilidades,positive,"AnalyzerOutput(output=POS, probas={POS: 0.955, NEU: 0.042, NEG: 0.003})"
loa inn hoteles,general quede satisfecha resultado practicas,en general quede muy satisfecha con el resultado de mis practicas,positive,"AnalyzerOutput(output=POS, probas={POS: 0.881, NEU: 0.110, NEG: 0.009})"
beetmann energy,trato humano siempre estan pendiente,el trato es muy humano siempre estan al pendiente,positive,"AnalyzerOutput(output=NEG, probas={NEG: 0.686, NEU: 0.294, POS: 0.019})"
hotel rotamundos,organizacion brindo beneficios comedor transporte remuneracion economica etc acordaron inicio practicas pregunta aplica via online entonces necesito respecto,"la organizacion te brindo los beneficios comedor transporte remuneracion economica etc que se acordaron al inicio de tus practicas
 esta pregunta no aplica ya que todo fue via online entonces no se necesito nada al respecto ",positive,"AnalyzerOutput(output=NEU, probas={NEU: 0.896, POS: 0.072, NEG: 0.033})"
tsystems mexico,excelente organizacion ambiente laboral increiblemente agradable existe buena comunicacion personal sugerencias practicantes nunca desestimadas menospreciadas jefe inmediato siempre encontro atento labores espiritu visionario excelente actitud desperto enorme gusto proyecto ademas explotar todas habilidades area sistemas tambien realizo gran trabajo multidisciplinario llevo gran exito proyecto duda derivo inmenso aprendizaje siento extremadamente satisfecho organizacion espero poder formar parte algun dia,"excelente organizacion el ambiente laboral es increiblemente agradable existe una muy buena comunicacion entre todo el personal y las sugerencias de los practicantes nunca son desestimadas o menospreciadas nuestro jefe inmediato siempre se encontro atento a nuestras labores y su espiritu visionario y excelente actitud desperto en mi un enorme gusto por el proyecto
ademas de explotar todas nuestras habilidades en el area de sistemas tambien se realizo un gran trabajo multidisciplinario lo que llevo a un gran exito del proyecto y sin duda derivo en un inmenso aprendizaje 
me siento extremadamente satisfecho con la organizacion y espero poder formar parte de ella algun dia ",positive,"AnalyzerOutput(output=POS, probas={POS: 0.953, NEU: 0.043, NEG: 0.004})"
new world monkeys,parece buena organizacion simplemente proyecto toco repetitivo relacionado carrera realmente aprendi gustado pusieran actividad parte conoci alguien mas dentro organizacion comento perfil parecia interesante dudara mandarle cv terminando carrera interesado tenerme,me parece una buena organizacion simplemente el proyecto que me toco fue muy repetitivo y nada relacionado a mi carrera realmente no aprendi mucho y me hubiera gustado que me pusieran otra actividad por otra parte conoci a alguien mas dentro de la organizacion que me comento que mi perfil le parecia interesante y que no dudara en mandarle mi cv terminando la carrera que estaba muy interesado en tenerme con ellos ,neutral,"AnalyzerOutput(output=POS, probas={POS: 0.653, NEU: 0.337, NEG: 0.010})"
expresion textil,flexibles abiertos,muy flexibles y abiertos,positive,"AnalyzerOutput(output=NEU, probas={NEU: 0.663, POS: 0.281, NEG: 0.056})"
corona net,siento bien contento experiencia brindo herramientas desarollo references carrera futura profesion,me siento bien y contento porque fue una experiencia que me brindo herramientas de desarollo references a mi carrera y futura profesion,positive,"AnalyzerOutput(output=POS, probas={POS: 0.844, NEU: 0.150, NEG: 0.006})"
hospital puebla,buena organizacion realizar practicas profesionales permite realizar distintas actividades solo complementan carreras estudio tambien muestren gran variedad riqueza area farmacia clinica importancia,es una muy buena organizacion para realizar practicas profesionales permite realizar distintas actividades que no solo complementan las carreras que estudio pero que tambien muestren la gran variedad y riqueza del area de farmacia clinica y su importancia ,positive,"AnalyzerOutput(output=POS, probas={POS: 0.800, NEU: 0.192, NEG: 0.009})"
carbomex,gente convivi accesible buenas personas hicieron sentir agusto empresa respecto trabajo espere mas pusieron hacer solo buscar cosas linea jamas pude conocer empresa trabajar algun objeto dentro,la gente con la que convivi es muy accesible y son muy buenas personas me hicieron sentir muy agusto en la empresa pero con respecto al trabajo espere mas de lo que me pusieron a hacer ya que solo tuve que buscar cosas en linea y jamas pude conocer la empresa o trabajar con algun objeto dentro de ella,negative,"AnalyzerOutput(output=POS, probas={POS: 0.675, NEU: 0.309, NEG: 0.017})"
 mujeres,mujeres excelente organizacion comparto intereses sociales realmente sido buena experiencia colaborar, mujeres es una excelente organizacion con quienes comparto intereses sociales realmente ha sido una buena experiencia colaborar con ellas  ,positive,"AnalyzerOutput(output=POS, probas={POS: 0.978, NEU: 0.019, NEG: 0.003})"
tsystems mexico,proyecto pude entrar gran ayuda desarrollo profesional proyecto real pusimos prueba conocimientos rapida adaptacion nuevas tecnologias solo simple proyecto practicantes igual forma comodo trabajar ponian limitaciones creatividad igual forma tampoco ignoraron opiniones recomendaciones dadas,el proyecto al cual pude entrar fue de gran ayuda para mi desarrollo profesional ya que fue un proyecto real en el cual pusimos a prueba los conocimientos y la rapida adaptacion a nuevas tecnologias y no solo un simple proyecto de practicantes de igual forma fue muy comodo trabajar ya que no ponian limitaciones a nuestra creatividad y de igual forma tampoco se ignoraron las opiniones yo recomendaciones dadas,positive,"AnalyzerOutput(output=NEU, probas={NEU: 0.780, POS: 0.137, NEG: 0.082})"
 revitaliza sa de cv,gran experiencia aprendi demasiado oportunidad conocer enfoque distinto carrera gusto abrio ojos quiero hacer futuro,fue una gran experiencia aprendi demasiado y tuve la oportunidad de conocer un enfoque distinto en mi carrera es algo que me gusto y me abrio los ojos sobre que quiero hacer en un futuro,positive,"AnalyzerOutput(output=POS, probas={POS: 0.940, NEU: 0.056, NEG: 0.005})"
impacto social consultores,sugiero den retroalimentacion menores lapsos tiempo gusta trabajan organizan bien nunca pierden comunicacion,sugiero que den la retroalimentacion en menores lapsos de tiempo pero me gusta mucho como trabajan ya que se organizan muy bien y nunca pierden comunicacion ,positive,"AnalyzerOutput(output=POS, probas={POS: 0.598, NEU: 0.369, NEG: 0.033})"
soluciones ecologicas de puebla,buena empresa personas quieren lograr cambio materia ambiental soluciones sustentables,muy buena empresa para personas que quieren lograr un cambio en materia ambiental y soluciones sustentables,positive,"AnalyzerOutput(output=POS, probas={POS: 0.725, NEU: 0.249, NEG: 0.026})"
consultoria quan kiu,experiencia brindo consultaria gran valor futuro profesional personal,la experiencia que me brindo la consultaria fue de gran valor para mi futuro profesional y personal ,positive,"AnalyzerOutput(output=NEU, probas={NEU: 0.770, POS: 0.208, NEG: 0.022})"
universidad autonoma de baja california,ojala pudiera esclarecer mejor parte organizacion cuanto tiempo anticipacion requieren reportes parciales finales puedan ser revisados firmados entregarlos tiempo udlap tambien gustaria proponer mejor comunicacion universidad organizaciones aceptan practicantes conocer especificamente documentos necesitan inicio practicas formato plataforma podemos adquirir,"ojala se pudiera esclarecer un poco mejor por parte de la organizacion con cuanto tiempo de anticipacion se requieren los reportes tanto parciales como finales para que puedan ser revisados y firmados para entregarlos a tiempo ante la udlap

tambien me gustaria proponer una mejor comunicacion entre nuestra universidad y las organizaciones que nos aceptan como practicantes para conocer especificamente los documentos que necesitan al inicio de las practicas en que formato y en que plataforma o con quien los podemos adquirir ",positive,"AnalyzerOutput(output=NEU, probas={NEU: 0.887, POS: 0.069, NEG: 0.044})"
servimsa,lamentablemente practicas linea pude aprovechar maximo experiencia trabajo ambiente laboral total embargo supervisor paciente explicaba gran detalle gusto,lamentablemente mis practicas fueron en linea y no pude aprovechar al maximo la experiencia de trabajo y el ambiente laboral total sin embargo mi supervisor era muy paciente y me explicaba todo a gran detalle me gusto mucho,positive,"AnalyzerOutput(output=NEU, probas={NEU: 0.729, POS: 0.207, NEG: 0.064})"
