ORGANIZACION,Comentario,Comentario Sin tratar,Etiqueta,Analyzer
las ventanas al paraiso rosewood resort,empresa sumamente recomendada realizar practicas permite conocer panorama hoteleria nivel ultra lujo ambiente laboral trato directivos colaboradores dias sido agradable respetuoso apoyo momento siento contenta depoder hotel conocer cada dia mas gran industria,es una empresa sumamente recomendada para realizar practicas permite conocer un panorama de la hoteleria en un nivel de ultra lujo el ambiente laboral y el trato de directivos y colaboradores todos los dias ha sido muy agradable respetuoso y de apoyo en todo momento yo me siento muy contenta depoder estar en este hotel y conocer cada dia mas de esta gran industria,positive,"AnalyzerOutput(output=POS, probas={POS: 0.956, NEU: 0.041, NEG: 0.004})"
frame lawyers global firm,realizacion practicas empresa altamente satisfactorias ambiente laboral bueno siempre disposicion ensenar preparar practicantes buen desarrollo profesion considero adquiri nuevos conocimientos seran gran utilidad,la realizacion de mis practicas en esta empresa fueron altamente satisfactorias el ambiente laboral es muy bueno pero sobre todo siempre tienen la disposicion de ensenar y preparar a los practicantes para un buen desarrollo de su profesion considero que adquiri muchos nuevos conocimientos que me seran de gran utilidad ,positive,"AnalyzerOutput(output=POS, probas={POS: 0.856, NEU: 0.139, NEG: 0.005})"
allianz,experiencia enriquecedora desarrollo personal profesional siento agradecida equipo suscripcion beneficios hicieron sentir parte equipo ensenaron respecto oferta trabajo comentaron pronto abriria vacante aun falta semestre terminar carrera sera posible aceptar oferta espero mas adelante vuelva dar oportunidad unica sugerencia allianz persona rh asignada practicantes udlap mas pendiente comentarios clara fecha deposito apoyo economico caso ningun mes recibi apoyo mismo dia,"fue una experiencia muy enriquecedora para mi desarrollo personal y profesional me siento muy agradecida con el equipo de suscripcion de beneficios que me hicieron sentir parte del equipo y me ensenaron mucho respecto a la oferta de trabajo me comentaron que pronto se abriria una vacante pero como aun me falta un semestre para terminar la carrera no me sera posible aceptar la oferta espero que mas adelante se vuelva a dar la oportunidad

la unica sugerencia a allianz es que la persona de rh asignada a los practicantes de la udlap este mas pendiente de nuestros comentarios y sea clara con la fecha del deposito del apoyo economico ya que en mi caso en ningun mes recibi el apoyo el mismo dia ",positive,"AnalyzerOutput(output=NEU, probas={NEU: 0.691, POS: 0.293, NEG: 0.015})"
proyecto interno cfa institute research challenge,llevo grandes aprendizajes gracias experiencia gran proyecto interno,me llevo grandes aprendizajes gracias a mi experiencia en este gran proyecto interno,positive,"AnalyzerOutput(output=POS, probas={POS: 0.967, NEU: 0.030, NEG: 0.004})"
corporativo ceoc,practicas corporativo ceoc excelentes,las practicas en corporativo ceoc fueron excelentes,positive,"AnalyzerOutput(output=POS, probas={POS: 0.738, NEU: 0.248, NEG: 0.014})"
operativo silla movil danza,operativo silla movil ademas adquirir experiencia interprete tambien obtuve conocimientos gestion produccion asi acercamiento experiencia artes sociedad actual brindandome necesario decidir forma quiero hacer danza,en operativo silla movil ademas de adquirir experiencia como interprete tambien obtuve conocimientos de gestion y produccion asi como un acercamiento y experiencia sobre las artes en la sociedad actual brindandome de lo necesario para decidir la forma en la que quiero hacer danza ,positive,"AnalyzerOutput(output=NEU, probas={NEU: 0.754, POS: 0.223, NEG: 0.023})"
faurecia puebla,faurecia empresa excelente arrepiento haber aqui espero pueda quedarme trabajar,faurecia es una empresa excelente no me arrepiento de haber estado aqui y espero que pueda quedarme a trabajar ,positive,"AnalyzerOutput(output=POS, probas={POS: 0.907, NEU: 0.086, NEG: 0.007})"
faurecia,sido experiencia llena aprendizaje voy contenta,ha sido una experiencia llena de aprendizaje me voy contenta,positive,"AnalyzerOutput(output=POS, probas={POS: 0.927, NEU: 0.068, NEG: 0.005})"
tsystems mexico,periodo practicas empresa tsystems oportunidad trabajar personas diferentes disciplinas permitiendome obtener nuevos conocimientos igual manera oportunidad aprender funciona compania obtener conocimientos temas externos area especialidad cuales van ayudar largo anos vida profesional,durante mi periodo de practicas con la empresa de tsystems tuve la oportunidad de trabajar con personas de diferentes disciplinas permitiendome obtener nuevos conocimientos de igual manera tuve la oportunidad de aprender como funciona una compania y obtener conocimientos sobre temas externos a mi area de especialidad los cuales se que me van a ayudar a lo largo de los anos en mi vida profesional,positive,"AnalyzerOutput(output=NEU, probas={NEU: 0.697, POS: 0.290, NEG: 0.013})"
agencia blanck,agradable ambiente laboral agencia amables,muy agradable el ambiente laboral de la agencia y muy amables ,positive,"AnalyzerOutput(output=POS, probas={POS: 0.941, NEU: 0.055, NEG: 0.004})"
stanley black and decker,ojala contraten,ojala me contraten ,positive,"AnalyzerOutput(output=NEU, probas={NEU: 0.692, POS: 0.155, NEG: 0.153})"
mundo imperial,experiencia buena amables conmigo condescendientes beneficios ofrecieron principio embargo segunda mitad estancia tareas realice tenian relacion carrera habilidades segundo supervisor asignado integro trabajo,"mi experiencia fue muy buena todos fueron muy amables conmigo y fueron condescendientes con los beneficios que me ofrecieron al principio 
sin embargo en la segunda mitad de mi estancia las tareas que realice no tenian relacion con mi carrera ni con mis habilidades y el segundo supervisor que fue asignado no me integro a su trabajo",positive,"AnalyzerOutput(output=NEU, probas={NEU: 0.508, POS: 0.474, NEG: 0.017})"
audi mexico,momento organizacion sido increible excelente,hasta el momento mi organizacion ha sido increible todo esta excelente ,positive,"AnalyzerOutput(output=POS, probas={POS: 0.965, NEU: 0.031, NEG: 0.004})"
bimbo,experiencia bimbo sido satisfactoria aprendido temas relacionados carrera adquirido conocimientos nuevos unico siento puede mejorar den mas capacitacion inicio calidad trabajo mejore desenvolvamos mas rapido empresa,mi experiencia en bimbo ha sido muy satisfactoria he aprendido mucho sobre temas relacionados a mi carrera y he adquirido muchos conocimientos nuevos lo unico que siento que puede mejorar es que nos den un poco mas de capacitacion al inicio para que la calidad de nuestro trabajo mejore y nos desenvolvamos mas rapido en la empresa,positive,"AnalyzerOutput(output=POS, probas={POS: 0.937, NEU: 0.058, NEG: 0.004})"
dos aguas consultiing,bien,todo muy bien,positive,"AnalyzerOutput(output=NEU, probas={NEU: 0.476, POS: 0.294, NEG: 0.230})"
centro de especializacion y atencion psicologica ceap,feliz haber concluido practicas,muy feliz de haber concluido mis practicas ,positive,"AnalyzerOutput(output=POS, probas={POS: 0.897, NEU: 0.096, NEG: 0.007})"
azgroup,gusto trabajar empresa dos anos practicas,me gusto trabajar en esta empresa mis dos anos de practicas ,positive,"AnalyzerOutput(output=NEU, probas={NEU: 0.654, POS: 0.244, NEG: 0.102})"
poder judicial del estado de puebla  tribunal administrativo,personal oportunidad asignaran jefe directo abogado varios anos puesto desempena bien asi tambien tacto ensenar momento,en lo personal tuve la oportunidad de que me asignaran un jefe directo abogado que tiene varios anos en el puesto y lo desempena muy bien asi como tambien tiene tacto para ensenar en todo momento,positive,"AnalyzerOutput(output=NEU, probas={NEU: 0.825, POS: 0.149, NEG: 0.026})"
faurecia puebla,sas automotive faurecia,sas automotive no faurecia,negative,"AnalyzerOutput(output=NEU, probas={NEU: 0.611, POS: 0.283, NEG: 0.106})"
hammerbyte games,excelente empresa personas comprometidas disciplinadas ambito d concept personas super talentosas calidas amables humanas aparte jovenes ejemplos seguir companeros amistades sanas recuerdan compromiso bueno divertido si apasiona encantaria quedarme,es una excelente empresa para personas comprometidas y disciplinadas en el ambito del d o concept las personas son super talentosas calidas amables y humanas aparte de jovenes tuve muchos ejemplos a seguir companeros y amistades sanas me recuerdan que el compromiso es bueno y divertido si te apasiona me encantaria quedarme con ellos,positive,"AnalyzerOutput(output=POS, probas={POS: 0.950, NEU: 0.045, NEG: 0.005})"
wmp mexico advisors,quede satisfecho practicas wmp mexico advisors aprendi entorno trabajo agradable,quede muy satisfecho con mis practicas con wmp mexico advisors aprendi mucho y el entorno de trabajo fue muy agradable ,positive,"AnalyzerOutput(output=POS, probas={POS: 0.940, NEU: 0.056, NEG: 0.005})"
r responsible research,buena oportunidad hacer practica periodo estudio universitario dio oportunidad aprender constantemente dias,muy buena oportunidad para mi de hacer una practica en el periodo de estudio universitario me dio la oportunidad de aprender constantemente todos los dias,positive,"AnalyzerOutput(output=POS, probas={POS: 0.886, NEU: 0.110, NEG: 0.004})"
h ayuntamiento de san salvador el verde,mtro humberto cuevas excelente coordinador practicas metodo forma trabajo bien delimitado explicado especificado principio siempre mantuvo orden excelente,el mtro humberto cuevas es un excelente coordinador de practicas el metodo y forma de trabajo estuvo muy bien delimitado explicado y especificado desde el principio siempre se mantuvo ese orden todo estuvo excelente,positive,"AnalyzerOutput(output=POS, probas={POS: 0.868, NEU: 0.120, NEG: 0.011})"
servicios multifuncionales de aire acondicionado,necesitan capacitar mejor manera practicantes,necesitan capacitar de mejor manera a los practicantes ,positive,"AnalyzerOutput(output=NEU, probas={NEU: 0.782, POS: 0.127, NEG: 0.092})"
swarm data  people,buena empresa constantes capacitaciones parecer necesitaria mas tiempo practicas poder aplicar mas conocimientos carrera actuaria ambiente bueno,es una muy buena empresa con constantes capacitaciones pero a mi parecer se necesitaria de mas tiempo en practicas para poder aplicar mas conocimientos sobre la carrera de actuaria el ambiente fue muy bueno,positive,"AnalyzerOutput(output=POS, probas={POS: 0.828, NEU: 0.165, NEG: 0.007})"
babys and kids,buena organizacion paciente conmigo exigente debia serlo aprendi muchas habilidades nuevas,fue una buena organizacion la cual fue paciente conmigo y exigente cuando debia serlo aprendi muchas habilidades nuevas,positive,"AnalyzerOutput(output=POS, probas={POS: 0.896, NEU: 0.097, NEG: 0.007})"
azgroup,buena empresa grande varios proyectos gustado participar mas mano solo actividades pequenas,es buena empresa son muy grande y tienen varios proyectos por lo que me hubiera gustado participar mas de la mano con ellos y no solo actividades pequenas ,positive,"AnalyzerOutput(output=POS, probas={POS: 0.880, NEU: 0.116, NEG: 0.004})"
altios mexico,senti comodo principio bien acogido altios tiempo companeros siempre mostraron aprecio tareas encomendaron exigentes menudo superaban ambito responsabilidad practicante dieron mucha confianza permitio aprender muchas cosas nuevas diverti trabajo creo ambas partes quedaron satisfechas ofrecieron contrato trabajo probablemente aceptare general solo puedo recomendar encarecidamente unas practicas altios comunicacion altios udlap tambien excelente unico comentario momento colocacion practicas solo recibi aceptacion definitiva semana comienzo practicas traslado ciudad mexico breve estresante tal vez puedan iniciar proceso colocacion practicas futuro,"me senti muy comodo desde el principio y fui muy bien acogido por altios durante todo el tiempo mis companeros siempre me mostraron su aprecio las tareas que me encomendaron eran muy exigentes y a menudo superaban el ambito de responsabilidad de un practicante por lo que me dieron mucha confianza esto me permitio aprender muchas cosas nuevas y me diverti en el trabajo 
creo que ambas partes quedaron muy satisfechas por lo que me ofrecieron un contrato de trabajo que probablemente aceptare 

en general solo puedo recomendar encarecidamente unas practicas en altios

la comunicacion entre altios y la udlap tambien fue excelente el unico comentario es el momento de la colocacion de las practicas solo recibi mi aceptacion definitiva una semana antes del comienzo de las practicas por lo que el traslado a la ciudad de mexico fue muy breve y estresante tal vez puedan iniciar el proceso de colocacion de practicas un poco antes en el futuro",positive,"AnalyzerOutput(output=NEU, probas={NEU: 0.631, POS: 0.339, NEG: 0.030})"
proyecto interno cfa institute research challenge,excelente experiencia dr larissa,excelente esta experiencia que tuve con la dr larissa,positive,"AnalyzerOutput(output=POS, probas={POS: 0.950, NEU: 0.046, NEG: 0.004})"
autotek industrial de mexico,pendiente area practicas muchas veces pase ratos desagradables,estar al pendiente en area de practicas muchas veces pase ratos desagradables,negative,"AnalyzerOutput(output=NEG, probas={NEG: 0.902, NEU: 0.091, POS: 0.007})"
bizrupt,gusto trato organizacion llevan realizar dice actividades,me gusto mucho tanto el trato que tienen como la organizacion que llevan al realizar las dice esa actividades,positive,"AnalyzerOutput(output=POS, probas={POS: 0.932, NEU: 0.063, NEG: 0.004})"
audi mexico,encanto,me encanto,positive,"AnalyzerOutput(output=NEU, probas={NEU: 0.496, NEG: 0.332, POS: 0.172})"
bimbo,buena empresa llena aprendizaje areas oportunidad mejorar procesos,muy buena empresa esta llena de aprendizaje y areas de oportunidad para mejorar procesos ,positive,"AnalyzerOutput(output=POS, probas={POS: 0.920, NEU: 0.077, NEG: 0.004})"
lander,interesante organizacion,fue muy interesante estar en esa organizacion,positive,"AnalyzerOutput(output=POS, probas={POS: 0.820, NEU: 0.171, NEG: 0.010})"
caiinno,gusto trabajar organizacion fortaleci aprendizaje parte investigacion juridico nacional internacional asi analizar comprender conceptos ciencia tecnologia,me gusto mucho trabajar con la organizacion fortaleci mi aprendizaje en la parte de investigacion juridico tanto nacional como internacional asi como analizar y comprender conceptos de ciencia y tecnologia ,positive,"AnalyzerOutput(output=POS, probas={POS: 0.705, NEU: 0.283, NEG: 0.012})"
fortinet,empresa ofrecio buena oportunidad aprendizaje desarrollo profesional veces si verdad llegaban presionar considerar seguia siendo estudiante pendientes parte trabajo general experiencia enriquecedora,la empresa me ofrecio una muy buena oportunidad de aprendizaje y desarrollo profesional a veces si es verdad que llegaban a presionar un poco sin considerar que seguia siendo estudiante y tengo otros pendientes a parte del trabajo pero en general la experiencia fue muy enriquecedora,positive,"AnalyzerOutput(output=POS, probas={POS: 0.685, NEU: 0.301, NEG: 0.014})"
ergo films,organizacion nivel profesionalidad alto aprendizaje mejor esperaba,la organizacion tiene un nivel de profesionalidad muy alto y mi aprendizaje fue mucho mejor de lo que esperaba,positive,"AnalyzerOutput(output=POS, probas={POS: 0.858, NEU: 0.133, NEG: 0.009})"
fundacion infantil ronald mcdonald,experiencia realizar practicas organizacion excelente aprendi mas esperado habilidades conocimientos aplicados casos escenarios reales ambiente lleno aprendizaje da gusto asistir ser parte cambios generan,mi experiencia al realizar mis practicas con la organizacion fue excelente aprendi mucho mas de lo esperado y sobre todo habilidades y conocimientos aplicados a casos o escenarios reales es un ambiente lleno de aprendizaje y al cual da gusto asistir y ser parte de los cambios que generan ,positive,"AnalyzerOutput(output=POS, probas={POS: 0.948, NEU: 0.049, NEG: 0.004})"
periodico sintesis,gusto ambiente trabajo personal amable siempre respondieron todas dudas,me gusto mucho el ambiente de trabajo el personal es muy amable y siempre respondieron a todas mis dudas ,positive,"AnalyzerOutput(output=POS, probas={POS: 0.727, NEU: 0.263, NEG: 0.010})"
proyecto interno cfa institute research challenge,caso organizacion sino proyecto interno,en este caso no fue una organizacion sino un proyecto interno ,positive,"AnalyzerOutput(output=NEU, probas={NEU: 0.877, NEG: 0.092, POS: 0.031})"
glabomex,excelente ambiente laboral proyectos bastante buenos desarrollar habilidades conocimientos adquiridos universidad buena opcion poder tomar experiencia confianza mismo,excelente ambiente laboral y con proyectos bastante buenos para desarrollar sus habilidades y conocimientos adquiridos en la universidad pero sobre todo una muy buena opcion para poder tomar experiencia y confianza en ti mismo,positive,"AnalyzerOutput(output=POS, probas={POS: 0.959, NEU: 0.038, NEG: 0.003})"
hammerbyte games,experiencia abre ojos realmente hace crecer profesional di cuenta cosas aun puedo mejorar desarrollador videojuego gran cultura empresarial embargo si comentar costo adaptarme velocidad trabajan mas tenia materias incluyendo practicas tenia responsabilidades programa honores servicio social flexibles comprensivos adaptan tareas acoplen posibilidades horario encantaron dinamicas grupales realizaban dan ganas seguir aprendiendo,"una experiencia que te abre los ojos y realmente te hace crecer como profesional me di cuenta de las cosas que aun puedo mejorar como desarrollador  de videojuego tienen una gran cultura empresarial sin embargo si hay que comentar que me costo adaptarme a la velocidad en la que trabajan mas que nada porque tenia  materias incluyendo practicas y tenia responsabilidades con el programa de honores y servicio social pero son flexibles  y comprensivos con esto con lo cual adaptan tus tareas para que se acoplen a tus posibilidades de horario 

me encantaron sus dinamicas grupales que realizaban me dan ganas de seguir aprendiendo y estar con ellos ",positive,"AnalyzerOutput(output=POS, probas={POS: 0.822, NEU: 0.168, NEG: 0.010})"
faurecia puebla,meses increibles aprendi creci profesional personalmente jefe gran ejemplo seguir llevo excelente experiencia,fueron  meses increibles donde aprendi mucho y creci tanto profesional como personalmente mi jefe es un gran ejemplo a seguir me llevo una excelente experiencia ,positive,"AnalyzerOutput(output=POS, probas={POS: 0.967, NEU: 0.029, NEG: 0.004})"
binex line mexico,entrevista comunique intencion regresar italia terminar estudios maestria razon ofrecieron oferta contratacion razon tratada manera diferente respecto practicante considero interesado darme capacitacion bastante tiempo muerto momentos dias cuales ademas preguntar podia ayudar tenia hacer mismo tiempo quiero decir siempre trataron respeto siempre volvieron parte juntas ademas quiero agregar practica sector logistico considero curso logistica udlap preparo manera adecuada falto conocimientos basicos ejemplo incoterms armar precio importacion exportacion respecto pregunta si organizacion brindo beneficios acordaron inicio practicas conteste nunca ofrecierondieron algun beneficio,"ya en la entrevista les comunique que mi intencion era la de regresar a italia para terminar mis estudios con una maestria razon por la cual no me ofrecieron una oferta de contratacion
por esta razon me he sentido tratada de manera diferente respecto a otro practicante considero que no se hayan interesado mucho en darme capacitacion y tuve bastante tiempo muerto o sea momentos o dias en los cuales ademas de preguntar como podia ayudar no tenia mucho o algo por hacer 
al mismo tiempo quiero decir que siempre me trataron con respeto y siempre me volvieron parte de sus juntas
ademas quiero agregar que mi practica fue en el sector logistico pero considero que el curso de logistica de la udlap no me preparo de la manera adecuada y falto de conocimientos basicos por ejemplo los incoterms o como armar un precio de importacion o exportacion

con respecto a la pregunta si la organizacion me brindo los beneficios que se acordaron al inicio de mis practicas conteste que no porque nunca me ofrecierondieron algun beneficio",neutral,"AnalyzerOutput(output=NEU, probas={NEU: 0.873, NEG: 0.079, POS: 0.048})"
swarm data  people,equipo trabajo excelente buenas personas,el equipo de trabajo es excelente todos son muy buenas personas,positive,"AnalyzerOutput(output=POS, probas={POS: 0.965, NEU: 0.031, NEG: 0.003})"
organo de fiscalizacion superior del congreso del estado de tlaxcala,aprende acerca funcion publica procesos legales interesante bueno,se aprende mucho acerca de la funcion publica y algunos procesos legales todo muy interesante y bueno ,positive,"AnalyzerOutput(output=POS, probas={POS: 0.674, NEU: 0.311, NEG: 0.015})"
pilu uniformes,organizacion estructurada aprendi bastantes cosas serviran largo vida profesional apoyo departamento actividades desarrolle hizo poder ganar experiencia valiosa servira futuro mas tomar modelo aquellos aprendizajes adquiri,una organizacion muy estructurada de la cual aprendi bastantes cosas que me serviran a lo largo de mi vida profesional ya que con el apoyo del departamento y las actividades que desarrolle me hizo poder ganar experiencia muy valiosa que se que me servira en un futuro y mas que nada el tomar como modelo todos aquellos aprendizajes que adquiri,positive,"AnalyzerOutput(output=POS, probas={POS: 0.723, NEU: 0.266, NEG: 0.011})"
vibrato instituto de musica,recomendaria organizacion mejor comunicacion saber actividades hacer largo practicas demas bien,recomendaria a la organizacion que haya mejor comunicacion para saber que actividades hacer a lo largo de las practicas pero todo lo demas estuvo bien  ,positive,"AnalyzerOutput(output=NEU, probas={NEU: 0.545, POS: 0.434, NEG: 0.021})"
pixolab,modalidad remota hace aprendizaje complicado especialmente si buena comunicacion ayudo aprender actitud ayuda lider,la modalidad  remota hace del aprendizaje muy complicado especialmente si no hay una buena comunicacion lo que a mi me ayudo a aprender fue la actitud y ayuda de mi lider,neutral,"AnalyzerOutput(output=NEU, probas={NEU: 0.712, POS: 0.172, NEG: 0.116})"
notaria publica no ,ambiente laboral notaria bueno personal companeros siempre explicaron calma buen trato trabajo debia realizar,el ambiente laboral en la notaria  es muy bueno el personal y mis companeros siempre me explicaron con calma y buen trato el trabajo que debia realizar ,positive,"AnalyzerOutput(output=NEU, probas={NEU: 0.557, POS: 0.378, NEG: 0.065})"
kunko yerbamate,cuanto beneficios nunca acordamos ninguna prestacion entonces creo pregunta aplica caso,en cuanto a los beneficios nunca acordamos ninguna prestacion entonces creo que la pregunta no aplica mucho para mi caso,positive,"AnalyzerOutput(output=NEU, probas={NEU: 0.698, NEG: 0.291, POS: 0.011})"
proyecto interno cfa institute research challenge,buen curso,buen curso,positive,"AnalyzerOutput(output=POS, probas={POS: 0.568, NEU: 0.369, NEG: 0.063})"
idea asset management,duda experiencia valiosa brindo muchas ensenanzas habilidades segura aplicare futuro,sin duda fue una experiencia muy valiosa que me brindo muchas ensenanzas y habilidades que estoy segura aplicare en el futuro,positive,"AnalyzerOutput(output=POS, probas={POS: 0.794, NEU: 0.199, NEG: 0.007})"
deforest,dejo experiencia esperaba agradecido organizacion,me dejo mucho experiencia que no esperaba agradecido con la organizacion,positive,"AnalyzerOutput(output=NEU, probas={NEU: 0.512, POS: 0.476, NEG: 0.012})"
acutech,desgraciadamente nunca pude ir hospital tiempo libero contratacion asi casi trabajo realice trabajo oficina administrativo,desgraciadamente nunca pude ir a hospital por que en el tiempo que estuve no se libero la contratacion asi que casi todo el trabajo que realice fue trabajo de oficina y administrativo ,positive,"AnalyzerOutput(output=NEG, probas={NEG: 0.569, NEU: 0.422, POS: 0.009})"
proyecto interno efectos del teletrabajo en la intencion de rotacion de personal,estaria mejor si tutor correspondiente proyecto interno mas atencion dudas atencion correos mandemos dudas hice proyecto final si bien,estaria mejor si el tutor correspondiente a proyecto interno de mas atencion a las dudas o atencion a los correos que me mandemos con nuestras dudas porque hice mi proyecto final pero no se si esta bien ,neutral,"AnalyzerOutput(output=NEU, probas={NEU: 0.893, POS: 0.059, NEG: 0.048})"
base ,principio acordaron beneficios practicas realizaron distancia,al principio no se acordaron beneficios porque las practicas se realizaron a distancia,positive,"AnalyzerOutput(output=NEU, probas={NEU: 0.854, NEG: 0.073, POS: 0.072})"
magistrada poder judicial federal,experiencia excelente,una experiencia excelente ,positive,"AnalyzerOutput(output=POS, probas={POS: 0.555, NEU: 0.335, NEG: 0.110})"
h ayuntamiento de puebla,trabajo equipo fundamental hacer actividades explicaciones oportunas siempre retroalimentacion embargo tambien ciertos deslices companeros siempre comunicacion pudo resolver evito escalara peores situaciones buen equipo mas jefa inmediata maria guadalupe garcia brenis siempre atenta equipo practicantes ademas excelente liderazgo,el trabajo en equipo fue fundamental para hacer las actividades las explicaciones fueron muy oportunas y siempre hubo retroalimentacion sin embargo tambien hubo ciertos de deslices con otros companeros pero siempre hubo comunicacion por lo que se pudo resolver que evito que escalara a peores situaciones muy buen equipo y mas de mi jefa inmediata maria guadalupe garcia brenis que siempre estuvo atenta de nosotros su equipo de practicantes ademas de su excelente liderazgo,positive,"AnalyzerOutput(output=POS, probas={POS: 0.707, NEU: 0.271, NEG: 0.022})"
