ORGANIZACION,Comentario,Comentario Sin tratar,Etiqueta,Analyzer
tokyoplay,,,positive,"AnalyzerOutput(output=POS, probas={POS: 0.498, NEU: 0.289, NEG: 0.213})"
museo regional de cholula,ocurrio nunca autorizo presupuesto proyecto incluyeron termine cuidando salas exposicion,lo que ocurrio es que nunca se autorizo el presupuesto para el proyecto en el que me incluyeron termine cuidando salas de exposicion ,negative,"AnalyzerOutput(output=NEG, probas={NEG: 0.783, NEU: 0.205, POS: 0.012})"
guru the brand buro,excelente experiencia vivi practicas profesion organizacion guru the brand buro realmente creo aprendi equipo involucraron aprendieramos experiencia,fue una excelente experiencia la que vivi en practicas en la profesion con mi organizacion en guru the brand buro realmente creo que aprendi mucho y que todos los del equipo se involucraron en que aprendieramos durante esta experiencia ,positive,"AnalyzerOutput(output=POS, probas={POS: 0.940, NEU: 0.055, NEG: 0.005})"
ipam,organizacion contacto mas inicio semestre dieron ninguna clase alimentacion trabajo entiendo problemas administrativos proceso mantuvieron lado cuerdo cumplieron compromiso udlap practicantes,la organizacion no tuvo contacto con nosotras mas que al inicio del semestre y no nos dieron ninguna clase de alimentacion durante el trabajo entiendo que hubo problemas administrativos durante el proceso pero no mantuvieron su lado del cuerdo ni cumplieron su compromiso con udlap o con nosotras como practicantes,negative,"AnalyzerOutput(output=NEU, probas={NEU: 0.650, NEG: 0.285, POS: 0.065})"
ipam,organizacion perdio contacto partir mitad semestre mayor retroalimentacion acompanamiento parte dra myrna iglesias retroalimentacion si util organizacion dio seguimiento proyecto,la organizacion perdio contacto con nosotras a partir de la mitad del semestre y la mayor retroalimentacion y acompanamiento fue por parte de la dra myrna iglesias esa retroalimentacion si fue util pero la organizacion dio muy poco seguimiento a nuestro proyecto ,negative,"AnalyzerOutput(output=NEU, probas={NEU: 0.851, NEG: 0.118, POS: 0.031})"
ipam,contacto continuo parte supervisor dejo trabajando deriva,no hubo un contacto continuo por parte de nuestro supervisor nos dejo trabajando a la deriva,negative,"AnalyzerOutput(output=NEU, probas={NEU: 0.858, NEG: 0.120, POS: 0.022})"
lado b,creo organizacion realice practicas excelente estudiantes aprendamos capacitemos,creo que la organizacion en la que realice mis practicas es excelente para que los estudiantes aprendamos y nos capacitemos,positive,"AnalyzerOutput(output=POS, probas={POS: 0.659, NEU: 0.326, NEG: 0.015})"
grupo eon,fecha inicio practicas agosto,la fecha de inicio de practicas fue el  de agosto ,positive,"AnalyzerOutput(output=NEU, probas={NEU: 0.843, POS: 0.106, NEG: 0.051})"
troop unit,buen lugar realizar practicas,muy buen lugar para realizar tus practicas,positive,"AnalyzerOutput(output=POS, probas={POS: 0.899, NEU: 0.098, NEG: 0.004})"
zaloa lenguages,gusta,nada me gusta,positive,"AnalyzerOutput(output=NEU, probas={NEU: 0.517, NEG: 0.313, POS: 0.169})"
contenedora n,logre aprender diferentes aspectos carrera,logre aprender sobre diferentes aspectos en mi carrera,positive,"AnalyzerOutput(output=POS, probas={POS: 0.811, NEU: 0.179, NEG: 0.010})"
consorcio mexicano de la llave,sugerencia mucha gente deberian dejar trabajos extras universidad si valgan menos,una sugerencia que tengo que y mucha gente tiene es que no nos deberian de dejar trabajos extras en la universidad o si pero que valgan menos ,positive,"AnalyzerOutput(output=NEG, probas={NEG: 0.674, NEU: 0.315, POS: 0.011})"
grupo oro,permitio trabajar casa i computadora gran tira permitia organizar mejor horarios practicas trabajo escuela,se me permitio trabajar en casa en i computadora y eso fue de gran tira y ya que me permitia organizar mejor mis horarios entre practicas trabajo y escuela ,positive,"AnalyzerOutput(output=NEU, probas={NEU: 0.545, POS: 0.435, NEG: 0.020})"
nami studios,importante ningun momento acorde organizacion recibir ciertos beneficios mencionan encuesta respondi pregunta,"importante 
en ningun momento acorde con la organizacion recibir ciertos beneficios como los que se mencionan en la encuesta por eso respondi que no a la pregunta ",positive,"AnalyzerOutput(output=NEU, probas={NEU: 0.806, NEG: 0.175, POS: 0.019})"
los otros puertos,escribo fecha limite noviembre dice carta inicio embargo pretendo trabajar rato mas proyecto,escribo la fecha limite de  de noviembre porque eso es lo que dice en la carta de inicio sin embargo pretendo trabajar un rato mas en este proyecto ,positive,"AnalyzerOutput(output=NEU, probas={NEU: 0.804, NEG: 0.177, POS: 0.018})"
nami studios,discutio temas transporte,no se discutio sobre temas de transporte ,neutral,"AnalyzerOutput(output=NEU, probas={NEU: 0.537, NEG: 0.360, POS: 0.103})"
imagen radio,lamentablemente ser repetidora radiodifusora roles establecidos trabajo suele volverse monotono quiza mejor opcion desarollar ciertas habilidades claro trabajas,"lamentablemente al ser una repetidora la radiodifusora ya tiene los roles muy establecidos y el trabajo suele volverse monotono 

quiza no es la mejor opcion para desarollar ciertas habilidades pero claro que trabajas algunas ",neutral,"AnalyzerOutput(output=NEU, probas={NEU: 0.601, NEG: 0.381, POS: 0.017})"
grupo oro,deberian ponerlos area produccion estudiamos promocion,deberian de ponerlos en la area de produccion es lo que estudiamos no en promocion ,positive,"AnalyzerOutput(output=NEU, probas={NEU: 0.860, NEG: 0.090, POS: 0.050})"
sat puebla,incomodo llegar instalaciones cuenten espacio si quiera poner computadora poder realizar actividades literalmente sillas esquina debes compartir espacio pasantes pido toda mesa espacio solo si lugar designado menos puedas realizar actividades forma mas comoda,es incomodo llegar a las instalaciones y que no cuenten con un espacio si quiera en donde poner tu computadora o poder realizar tus actividades literalmente tienen sillas en una esquina donde debes compartir espacio con otros pasantes no pido que tengas toda una mesa o espacio para ti solo pero si un lugar designado para que al menos puedas realizar tus actividades de forma un poco mas comoda,neutral,"AnalyzerOutput(output=NEG, probas={NEG: 0.764, NEU: 0.226, POS: 0.010})"
frame lawyers,excelente despacho quedo satisfecha aprendido,excelente despacho quedo satisfecha con todo lo que he aprendido ,positive,"AnalyzerOutput(output=POS, probas={POS: 0.956, NEU: 0.039, NEG: 0.005})"
volkswagen mexico,jefa directa nunca fomento trabajos relacionados carrera solo ayude aligerar carga administrativa trabajo,"mi jefa directa nunca me fomento trabajos relacionados con mi carrera 
solo le ayude a aligerar su carga administrativa de trabajo 
",negative,"AnalyzerOutput(output=NEU, probas={NEU: 0.516, NEG: 0.468, POS: 0.016})"
sat puebla,encargada accesible horarios universidad servicio social etc brindo toda capacitacion realizar practicas,mi encargada fue muy accesible con mis horarios de la universidad servicio social etc y me brindo toda la capacitacion para realizar mis practicas,positive,"AnalyzerOutput(output=NEU, probas={NEU: 0.850, POS: 0.121, NEG: 0.029})"
castellanos abogados fiscalistas,buenas practicas campo aprendizaje,muy buenas practicas con campo de aprendizaje,positive,"AnalyzerOutput(output=POS, probas={POS: 0.904, NEU: 0.091, NEG: 0.005})"
poder judicial de la federacion,mejor lugar mejorar capacitacion profesional abogado,el mejor lugar para mejorar mi capacitacion profesional como abogado ,positive,"AnalyzerOutput(output=POS, probas={POS: 0.495, NEU: 0.491, NEG: 0.013})"
despacho esparragoza ramirez y asociados,apendi bastante derecho fiscal administrativo parece buena organizacion recomendaria ampliamente,apendi bastante de derecho fiscal y administrativo me parece una buena organizacion y la recomendaria ampliamente,positive,"AnalyzerOutput(output=POS, probas={POS: 0.783, NEU: 0.208, NEG: 0.009})"
consejeria juridica del ejecutivo del estado de puebla,aprendi espacio oportunidad realizar practicas profesion puse practica teoria adquirida largo carrera experiencia satisfactoria,aprendi mucho en el espacio en donde tuve la oportunidad de realizar practicas en la profesion puse en practica la teoria adquirida a lo largo de mi carrera fue una experiencia satisfactoria ,positive,"AnalyzerOutput(output=POS, probas={POS: 0.540, NEU: 0.444, NEG: 0.016})"
dif municipal de san pedro cholula,ningun comentario sugerencia total agrado,no tengo ningun comentario ni sugerencia ya que todo fue de mi total agrado ,positive,"AnalyzerOutput(output=NEU, probas={NEU: 0.662, NEG: 0.309, POS: 0.028})"
corporativo ceoc,gusto oportunidad aprender muchas cosas nuevas relacion carrera ramas derecho tratar interesantes jefe comprensivo poca experiencia campo laboral embargo abogadas engardas siempre mostraron buenos tratos paciencia hacia,me gusto que tuve la oportunidad de aprender muchas cosas nuevas con relacion a mi carrera las ramas de derecho a tratar fueron interesantes y mi jefe fue muy comprensivo con mi poca experiencia en el campo laboral sin embargo las otras abogadas engardas no siempre mostraron buenos tratos ni paciencia hacia mi ,positive,"AnalyzerOutput(output=POS, probas={POS: 0.697, NEU: 0.287, NEG: 0.016})"
poder judicial del estado de puebla,depende area asignen,depende mucho del area a la cual te asignen ,positive,"AnalyzerOutput(output=NEU, probas={NEU: 0.876, POS: 0.075, NEG: 0.050})"
tsystems,excelente organizacion desarrollar ambito profesional embargo lastima buscarlo lado departamento deficiente area vinculacion,fue una excelente organizacion para desarrollar el ambito profesional sin embargo es una lastima que tuviera que buscarlo por mi lado ya que el departamento fue deficiente en el area de vinculacion ,positive,"AnalyzerOutput(output=NEG, probas={NEG: 0.902, NEU: 0.081, POS: 0.017})"
notaria no  de puebla,buena organizacion hacer practicas todas personas trabajan ahi siempre ensenan titular notaria igualmente preocupada practicantes ensena igual,muy buena organizacion para hacer practicas todas las personas que trabajan ahi siempre te ensenan algo y la titular de la notaria igualmente preocupada por los practicantes y te ensena ella igual,positive,"AnalyzerOutput(output=POS, probas={POS: 0.676, NEU: 0.312, NEG: 0.013})"
sat puebla,personas sat trataron excelente habia excelente ambiente trabajo cada duda resolvieron,las personas en el sat me trataron excelente habia un excelente ambiente de trabajo y cada duda que tuve me la resolvieron ,positive,"AnalyzerOutput(output=POS, probas={POS: 0.949, NEU: 0.045, NEG: 0.006})"
juridico empresarial moreno viveros,contenta aprendi muchas cosas nuevas relacionadas carrera,estuve muy contenta y aprendi muchas cosas nuevas relacionadas con mi carrera ,positive,"AnalyzerOutput(output=POS, probas={POS: 0.943, NEU: 0.053, NEG: 0.004})"
h ayuntamiento de san andres cholula,parte sindicatura unidad gestoria mas actividades,como parte de la sindicatura en la unidad de gestoria tienes mas actividades ,neutral,"AnalyzerOutput(output=NEU, probas={NEU: 0.803, POS: 0.140, NEG: 0.058})"
ludicultura,grata estancia dentro organizacion pude aplicar conocimientos adquiri largo carrera ademas aprender nuevas cosas seran utilidad vida profesional,fue muy grata mi estancia dentro de la organizacion pude aplicar los conocimientos que adquiri a lo largo de mi carrera ademas de aprender nuevas cosas que me seran de utilidad en mi vida profesional,positive,"AnalyzerOutput(output=POS, probas={POS: 0.950, NEU: 0.046, NEG: 0.004})"
calpulli de los ninos,gusto trabajar equipo embargo costo trabajo encontrarle estructura organizacion proyecto considero factores determino coordinadora proyecto pesar ser gran persona involucrada proyectos dificulta estructura proyecto,me gusto mucho trabajar con el equipo sin embargo me costo trabajo encontrarle estructura y organizacion al proyecto considero que uno de los factores que determino esto fue que la coordinadora del proyecto a pesar de ser una gran persona esta involucrada en otros y muchos proyectos lo cual dificulta la estructura del proyecto ,neutral,"AnalyzerOutput(output=NEU, probas={NEU: 0.534, NEG: 0.418, POS: 0.048})"
dif municipal de san andres cholula,gusto colaborar organizacion valoran trabajo estancia area trabajo,me gusto mucho colaborar con la organizacion valoran mucho tu trabajo y tu estancia en el area de trabajo,positive,"AnalyzerOutput(output=POS, probas={POS: 0.632, NEU: 0.359, NEG: 0.010})"
instituto interactivo alfred binet,agreguen mas empresas,que agreguen mas empresas ,positive,"AnalyzerOutput(output=NEU, probas={NEU: 0.786, POS: 0.136, NEG: 0.078})"
fundacion annur,escenario maravilloso club gran personal trabajando aprendi muchisimo mas esperaba expectativas revasaron realidad contenta ello,"el escenario fue maravilloso
el club tiene a un gran personal trabajando para ellos aprendi muchisimo mas de lo  que esperaba mis expectativas revasaron a la realidad estoy muy contenta con ello",positive,"AnalyzerOutput(output=POS, probas={POS: 0.967, NEU: 0.030, NEG: 0.003})"
fundacion annur,aprende personas amables ambiente agradable,se aprende mucho son personas amables y el ambiente es agradable,positive,"AnalyzerOutput(output=POS, probas={POS: 0.917, NEU: 0.078, NEG: 0.005})"
dif municipal de san andres cholula,area general psicologia buena,el area general de psicologia no es buena,neutral,"AnalyzerOutput(output=NEU, probas={NEU: 0.504, POS: 0.484, NEG: 0.012})"
dif municipal de san andres cholula,equilibren mejor manera numero pacientes cada psicologo,"que equilibren de mejor manera el numero de pacientes a cada psicologo
",positive,"AnalyzerOutput(output=NEU, probas={NEU: 0.849, POS: 0.092, NEG: 0.059})"
hospital puebla,tenian proyecto especifico psicologia,no tenian un proyecto especifico para psicologia ,negative,"AnalyzerOutput(output=NEU, probas={NEU: 0.891, NEG: 0.075, POS: 0.034})"
fundacion ronald mcdonald,supuso reto personal tener plan concreto trabajo organizacion practicas psicologia gracias ello apoyo desarrolle autonomia desarrollo implementacion programas actividades profesional estudiante siguiendo plan trabajo,me supuso un reto personal no tener un plan concreto de trabajo por la organizacion para practicas en psicologia pero gracias a ello y su apoyo desarrolle mi autonomia en el desarrollo e implementacion de programas y actividades como profesional y no como estudiante siguiendo un plan de trabajo,positive,"AnalyzerOutput(output=NEU, probas={NEU: 0.634, POS: 0.342, NEG: 0.024})"
centro de especializacion y atencion psicologica ceap,buen lugar aprendes capacitan,es un buen lugar donde aprendes y te capacitan,positive,"AnalyzerOutput(output=POS, probas={POS: 0.954, NEU: 0.040, NEG: 0.005})"
h ayuntamiento del estado de puebla,ambiente trabajo bueno jefes companeros apoyaron facilitaban actividades centro,el ambiente de trabajo es muy bueno mis jefes y companeros me apoyaron mucho y facilitaban mis actividades en el centro,positive,"AnalyzerOutput(output=POS, probas={POS: 0.897, NEU: 0.098, NEG: 0.005})"
colegio americano,duda colegio americano sido partes mas importantes tiempo universidad largo cuatro anos tomado clases maestros cumplen expectativas nivel educacion dejado insatisfecha practicas maravilloso cambio ofreciendome mas aprendizajes adquirido semestres permitieron primera vez poner practica aprendiendo abrio ojos hacia mundo real ayudando prepararme vida despues graduacion colegio americano siempre atento necesidades empleados practicantes dispuestos proporcionar asistencia tambien solo hacen pide sino van mas alla cumplir forma satisfactoria brindando mejores resultados consejeria equipada mejores materiales consejeros extremadamente competentes preparados departamento primaria sobresale constantemente demostrando cumplen espera mas ambiente permitio adquiriera nuevos aprendizajes dias momento empece hicieron sentir bienvenida parte comunidad,sin duda el colegio americano ha sido de las partes mas importantes de mi tiempo en la universidad a lo largo de mis cuatro anos he tomado clases con maestros que no cumplen con mis expectativas y un nivel de educacion que me ha dejado muy insatisfecha mis practicas fueron un maravilloso cambio ofreciendome mas aprendizajes de los que he adquirido en  semestres y me permitieron por primera vez poner en practica lo que he estado aprendiendo me abrio los ojos hacia el mundo real ayudando a prepararme para mi vida despues de mi graduacion el colegio americano siempre esta atento a las necesidades de su empleados y practicantes y dispuestos a proporcionar asistencia tambien no solo hacen lo que se les pide sino que van mas alla para cumplir de forma satisfactoria brindando los mejores resultados su consejeria esta equipada con los mejores materiales y consejeros extremadamente competentes y preparados el departamento de primaria sobresale constantemente demostrando que cumplen con lo que se espera de ellos y mucho mas el ambiente permitio que adquiriera nuevos aprendizajes todos los dias y desde el momento que empece me hicieron sentir bienvenida y como parte de la comunidad ,positive,"AnalyzerOutput(output=POS, probas={POS: 0.621, NEU: 0.358, NEG: 0.021})"
casa del sol,si aprendes parte psicologa ahi sabe acerca varios temas entonces investigar parte informarte si aprendi muchisimo parte esfuerzo unico enseno aplicar pruebas calificarlas,si aprendes es por tu parte ya que la psicologa que esta ahi no sabe mucho acerca de varios temas entonces tienes que investigar todo por tu parte e informarte si aprendi muchisimo fue por mi parte y mi esfuerzo lo unico que me enseno fue el aplicar pruebas y calificarlas,negative,"AnalyzerOutput(output=NEU, probas={NEU: 0.528, POS: 0.450, NEG: 0.022})"
casa del sol,informar reglas principio dar lista actividades va realizar cumplan mas apertura hacia practicantes gustaba participaramos tomaban serio,informar las reglas desde el principio dar una lista de actividades que se va a realizar y que la cumplan mas apertura hacia las practicantes ya que no les gustaba que participaramos no nos tomaban en serio ,negative,"AnalyzerOutput(output=NEU, probas={NEU: 0.860, NEG: 0.079, POS: 0.061})"
instituto interactivo alfred binet,buena organizacion apoyan personal amable,es una muy buena organizacion te apoyan mucho y el personal es muy amable,positive,"AnalyzerOutput(output=POS, probas={POS: 0.961, NEU: 0.035, NEG: 0.003})"
consultoria quan kiu,practicas aprendi relevante ayudara profesionalmente futuro actividades realice prepararon suficiente ambiente excelente lamentablemente actividades realice preparacion profesional gustado,durante mis practicas no aprendi algo relevante que me ayudara profesionalmente en un futuro las actividades que realice no me prepararon suficiente el ambiente es excelente pero lamentablemente las actividades que realice no fueron para una preparacion profesional como me hubiera gustado ,negative,"AnalyzerOutput(output=POS, probas={POS: 0.705, NEU: 0.287, NEG: 0.009})"
casa de salud,creo area psicologia buena embargo parte organizacional encuentra problemas constantes cambios reglamentos propician clima trabajo hostil dificulta actividades realizadas dentro clinica si bien experiencia mala varias experiencias dejan insatisfecha manera profesional creo organizacion deberia tomar mas seriedad practicantes,creo que el area de psicologia es buena sin embargo la parte organizacional se encuentra en problemas por constantes cambios de reglamentos sin sentido que propician un clima de trabajo hostil y dificulta las actividades realizadas dentro de la clinica si bien mi experiencia no fue mala tuve varias experiencias que me dejan insatisfecha de manera profesional creo que la organizacion deberia tomar con mas seriedad a sus practicantes,neutral,"AnalyzerOutput(output=NEG, probas={NEG: 0.899, NEU: 0.095, POS: 0.006})"
capital psicologico mexicano,agrado hacer aqui practicas asesor siempre pendiente exigirme,"me agrado hacer aqui mis practicas mi asesor siempre estuvo pendiente sin sobre exigirme

",positive,"AnalyzerOutput(output=NEU, probas={NEU: 0.616, POS: 0.362, NEG: 0.022})"
volkswagen mexico,,nada,positive,"AnalyzerOutput(output=POS, probas={POS: 0.498, NEU: 0.289, NEG: 0.213})"
colegio humbolt,organizacion bonita dejan mezclarte fondo ambiente parece bastante valioso,es una organizacion bonita porque te dejan mezclarte a fondo en su ambiente y eso me parece bastante valioso,positive,"AnalyzerOutput(output=POS, probas={POS: 0.970, NEU: 0.026, NEG: 0.004})"
